{
  "$schema": "https://json-schema.org/draft/2020-12/schema",
  "$id": "https://example.invalid/self-growing-kb/agent-outcome.schema.json",
  "title": "Agent Knowledge Outcome",
  "type": "object",
  "required": ["trace_id", "agent_id", "task_id", "tenant_id", "principal", "outcome_summary"],
  "properties": {
    "trace_id": {"type": "string", "minLength": 1},
    "agent_id": {"type": "string", "minLength": 1},
    "task_id": {"type": "string", "minLength": 1},
    "tenant_id": {"type": "string", "minLength": 1},
    "principal": {"type": "string", "minLength": 1},
    "outcome_summary": {"type": "string", "minLength": 1},
    "claims": {"type": "array"},
    "decisions": {"type": "array"},
    "artifacts": {"type": "array"},
    "suggested_updates": {
      "type": "array",
      "items": {
        "type": "object",
        "required": ["type", "title", "summary", "evidence", "permission_scope"],
        "properties": {
          "type": {"type": "string"},
          "page_id": {"type": "string", "pattern": "^[A-Za-z0-9][A-Za-z0-9._-]{0,127}$"},
          "title": {"type": "string"},
          "summary": {"type": "string"},
          "valid_from": {"type": "string"},
          "expected_revision_id": {"type": ["string", "null"]},
          "replacement_markdown": {"type": "string"},
          "evidence": {"type": "array", "items": {"type": "string"}},
          "permission_scope": {"type": "string"},
          "cross_repository": {"type": "boolean"}
        },
        "additionalProperties": true
      }
    },
    "learning_signals": {
      "type": "array",
      "items": {
        "type": "object",
        "required": ["signal_type", "title", "summary", "evidence", "permission_scope"],
        "properties": {
          "signal_type": {
            "enum": ["correction", "successful_pattern", "stale_claim", "conflict", "missing_knowledge"]
          },
          "title": {"type": "string"},
          "summary": {"type": "string"},
          "evidence": {"type": "array", "items": {"type": "string"}},
          "permission_scope": {"type": "string"}
        },
        "additionalProperties": true
      }
    }
  },
  "additionalProperties": true
}
